cleaned_spacy_two,sentiment_label_values
warning issue covid vaccine mrna find breast milk news usnews canada usa cdc covid covid healthcare health covidvaccine covidbooster vaccinemandate hospitalization vaccination vaccineinjurie vaccinesideeffect,0
common gene variant link covid mortality covid genetic health science,0
update covid coronavirus booster authorize young age soon early october vaccine sarscov immunization vaccination disease healthcare,0
  important covid datum point break prevail narrative covid health horowitz,0
alot prayer quick speedy recovery cheetay allah almighty bless great health naseemshah pakistancricket covid,1
gov acknowledge big role private player complement effort health care provision clear covid time public sector flood patient private sector shoulder rest patient need,1
finland covid case rise health authority predict,0
  scientificresearch datum drive prediction covid case germany decision make covid science health medical study research covid sarscov,0
time question authority accountable file rti rtiwala click link monkeypox hospital mosquito health medicine malariaprevention filerti rtionline rtiwala onlinerti legaltech,0
  exactly happen uk covid gps hide restriction put pressure nhs amp service time get gp uk happen,0
warning issue covid vaccine mrna find breast milk news usnew usa cdc fda covid covid healthcare health covidvaccine covidbooster vaccinemandate hospitalization vaccination vaccineinjurie vaccinesideeffect,0
federal bureaucrat lie hide agenda cdc covid health statistic,-1
antibody studyfarmer antibodie covid science coronavirus antibody research biology virus immunesystem immunebooster biotechnology health satinskinz immunity corona scicomm antivirus surgery vaccine immunohistochemistry remicade microscopy,0
  like ask emerge public health challenge like one ongoing smoking roadsafety cvd covid,1
probe order chinese health worker dump rice egg covid prevention covid covidnewstoday news,0
government force vaccine commit crime against humanity comorbiditie covid disease health,0
human continue shitory public health failure destorye sic kill nhsprivatisation cronyvirus covid enoughisenough,-1
datum june cdc show american adult contract covid nearly long covid symptom health covid,0
  scientificresearch multiple use telemedicine pandemic evidence cross sectional survey covid science health medical study research covid sarscov,0
sask health refund covid testing cost drop disciplinary action nurses news canada nurse vaccinemandate hospitalization saskatchewan sk government covid covid antilockdown lockdowns healthcare health covidvaccine,0
getting vaccinate against covid ensure don compromise health daily interaction complete recommend vaccination dose today chanjwa pata chanjo tuwe chonjo chanjwa tuwechonjo,0
supreme committee fan attend year fifa world cup encourage familiarize qatar covid travel amp return policy update ministry public health august qna sport,1
sask woman die allegedly right receive covid shot news canada saskatchewan vaccineinjurie covid covid vaccinedeath covidbooster government healthcare vaccinedeath health covidvaccine vaccinemandate,-1
  digital covid recovery health service firefamily book,0
la county report covid death lacounty covid health lanew heysocal,0
china national health commission thursday warn against size fit excessive covid control policy upcoming national day holiday pose high transmission risk,0
americans die covid summer toll mean covid continue kill people day vehicle crash gun violence flu health threat covidbooster,-1
  scientificresearch retrospective analysis pattern opioid overdose intervention deliver tertiary hosp covid science health medical study research covid sarscov,0
source yomidr jp intervention improve nutrition metabolism critical reduce disease burden covid pandemic read antiadditive additive health ultraprocesse covid covid pandemic coronavirus nutrition,0
  recent official uk datum indicate rise hospitalisation positive test zoe datum indication new wave daily new symptomatic uk covid case estimate zoe datum uk covid currently health protection,1
  recent official uk datum indicate rise hospitalisation positive test look zoe indication new wave daily new symptomatic uk covid case estimate zoe datum uk covid currently health protection,1
  india thursday report fresh covid infection past hour against previous day count union health ministry datum,0
late health safety daily thank covid covid,1
late integrate health daily thank lindgren covid covid,0
israel prove stupidity bureaucrat stupidity continue listen bureaucrat covid health israel politician,-1
boris rescues england rescue boris covid england experts health johnson uk unitedkingdom,1
health sector see high number vacant position report fourth quarter india battle wave covid report job healthsector pandemic covid,0
  scientificresearch safety interhospital helicopter transfer ventilate covid patient no clinical relevan covid science health medical study research covid sarscov,0
  canada remove covid travel restriction oct healthnewsnextme beforeyourtravel doctornextme healthnews healthcare mentalhealth health tourism visitgreece travel travelguide covid covid coronavirus vaccination,0
pass trend usd bn market clean beauty table stake beauty personal care brand beautyindustry cleanbeauty fabindia goodglammgroup plum cleanbrand covid consumerbehavior naturalingredient organicproduct,1
health chief warn twindemic resurgent flu covid winter urge million people england vaccinate,-1
health chief warn twindemic resurgent flu covid winter urge million people england vaccinate,-1
sask health refund covid testing cost drop disciplinary action nurses news canada nurse vaccinemandate hospitalization sask saskatchewan sk covid covid antilockdown lockdowns healthcare health covidvaccine,0
health chief warn twindemic resurgent flu covid winter urge million people england vaccinate,-1
  scientificresearch early stimulate immune response predict clinical disease severity hospitalize covid patient covid science health medical study research covid sarscov,0
late science technology daily thank xpress health covid cancer,0
  home doctor care give comprehensive health care stayathome covid homenurse covid coronavirus uaehealthcare homehealthcare pcrtest pcr homecare homehealthcarenurse reaat reaatuae,1
disinfect home room room information need home safe amp squeaky clean covid health healthy healthyliving covid kid design healthcare safety healthtip success lifestyle home,1
die patient see person example dr google helpful patient know incompetent staff fail primary care staff scared covid phone secondary care suffice patientsafety,0
  scientificresearch concomitant myocarditis painless thyroiditis astrazeneca coronavirus disease vaccinat covid science health medical study research covid sarscov,0
late tuffen fitness daily thank health covid,1
covid change people personality study suggest covid adult stress science health lockdown trust relationship,0
warning issue covid vaccine mrna find breast milk news usnews canada usa fda covid covid healthcare health covidvaccine covidbooster vaccinemandate hospitalization vaccination vaccineinjurie vaccinesideeffect,0
know symptom diabetes type diabetes type health diabetic diabetestype diabetesawareness stroke diabetestipo cancer insulin healthylifestyle diet colesterol weightloss covid fitness obatdiabete herbal,-1
world heart day asianlinkacademy asianlinkjobs worldheartday heart hearthealth heartday health healthyheart healthy heartdiseaseawareness useheart healthylife heartbeat heartsurgery healthyheart healthylive healthylifestyle heart covid healthcare,1
  scientificresearch thematic analysis system wide learning wave covid east england covid science health medical study research covid sarscov,0
active covid case decline day ago union health ministry,0
  ontario no long pursue charge against elect mp amp member mpp attend covid restriction protest dereksloan amp randyhillier people charge violate public health order june thank courage,-1
health benefit zincsupplement vivaceutical healthcare health covid medical medicine doctor hospital nurse doctor healthylifestyle wellness coronavirus healthy healthylive surgery pharmacy nurse nursing fitness care nurselife skincare,1
  billion covid australian government announce extra billion extend covid response measure read covid billion government agedcare healthcare health pandemic wa australia,0
medicare advantage hmo plan benefit medicare advantage hmo plan medicare healthcare insurance medicaid healthinsurance health medicareadvantage lifeinsurance medical covid insuranceagent medicaresupplement medicareforall,1
change cycle warn covid vaccine link temporary change menstrual cycle new study confirm stoptheshot covid,0
  scientificresearch specific cell response guide treatment convalescent plasma severe covid humo covid science health medical study research covid sarscov,0
warning issue covid vaccine mrna find breast milk news usnews canada usa cdc fda covid covid healthcare health covidbooster vaccinemandate hospitalization vaccination vaccineinjurie vaccinesideeffect,0
love heart hurt medigate app come soon khayalsehatka pharmacy pharmacist medicine medical health healthcare pharma covid pharmacylife pharmacist pharmaceutical medigate medigateonline heartday worldheartday,1
famous pro vaccine doctor suspect pfizer booster shot send cancer overdrive child health defense covid vaccine,-1
evil public health bureaucrat expose biden ccp covid fauci publichealth vaccine,-1
study show covid pandemic negatively impact uk student learning development canada australia newzealand europe politics government cdnpoli covidsk covid healthcare health covidvaccine covidbooster school education,0
  need covid summit union business immunologist importantly public health introduce proper public health policy protect australian butler mp theprojecttv thedrum rnbreakfast,1
  head public health perth publish advice govt spokesperson rubbish relate health advice give senior public health dubious say wrong not take covid seriously,-1
  scientificresearch year operation status datum analysis human milk bank east china covid science health medical study research covid sarscov,0
free instant covid test documentation work travel amp event newmexico abq albuquerque medicine health healthy ill sick covid covid travel event mask life restauranteur entrepreneur business,0
fact check new covid booster test mouse matter fluvaccine test manner year people stupid misinformed,-1
  covid change people personality study suggest health,0
  covid ministry health family covid vaccination day total vaccine dose give till today cowin dose administer date,0
  covid ministry health family welfare inform covid vaccination year start till today dose covid vaccine administer,0
vaccine provider polk county offer covid flu vaccine contact health care provider local pharmacy polk county public health schedule appointment togetherwecan flu covid vaccinate protection,0
  covid ministry health family claim vaccine dose provide number dose state ut total number dose utilize include wastage remain,0
covid old parent pre exist health condition don polst form refrigerator prominent location need eldercare longcovid caretaker healthcare,0
  scientificresearch factor contribute sharing covid health information refugee community covid science health medical study research covid sarscov,0
proof require evil worthlessness public health bureaucrat bureaucrat covid florida publichealth vaccine,-1
  stupid inject go health problem rest life amp guess sue pharmaceutical company consider emergency authorization newworldorder covid,-1
health aged care minister butler mp announce research grant focus investment critical innovative medical research include newcastle project focus number disease include heartattack stroke covid,1
job creation opportunity aplenty ignore covid transmission construction long covid clinic health care icu staff amp manual labor grave digger loss health wealth covidisnotover covid covid,1
study show covid pandemic negatively impact uk student learning development usa canada australia europe politics government cdnpoli covidsk covid healthcare health covidvaccine covidbooster school education,0
  scientificresearch transmission dynamic sars cov british columbia large school district second covid science health medical study research covid sarscov,0
beat life go healthy heart don let cardiovascular disease ruin life stay happy healthy happy world heart day detail contact doctor laparoscopicsurgery covid medicine health,1
  disaster disaster underinvestment public health system obstruct response covid monkeypox walensky say healthcare,-1
covid infection increase likelihood dementia diagnosis nearly people old year contract infection read covid dementia health baywoodhomecare,0
shoot fall qanda answer covid flushot health safetyfirst bewell,0
warning issue covid vaccine mrna find breast milk news usnews canada usa cdc fda covid covid healthcare health covidvaccine covidbooster vaccinemandate hospitalization vaccinesideeffect,0
individual ve covid experience increase mentalhealth distress ohsu long covid program resource help,0
study show covid pandemic negatively impact uk student learning development usa canada australia newzealand politic government cdnpoli covidsk covid healthcare health covidvaccine covidbooster school education,0
ssdi benefit possible qualify criterion murky disabilityinsurance longcovid covid,0
  point soon write twitter thread compare quebec seven day covid mortality rate million population country january public health institute inspq stop publish chart,0
  scientificresearch health behaviour change uk adult pandemic finding covid cancer attit covid science health medical study research covid sarscov,-1
  americans worried mentalhealth covid new survey year rate mental health health concern put americans list learn result,0
need covid resource city phoenix cover connect home testing kit kn mask mobile testing van vaccine event health information speed late information,0
fauci admit lockdown negative consequence article george william fauci health covid,0
  scientificresearch herpesviridae lung reactivation infection patient severe covid influenza virus pn covid science health medical study research covid sarscov,0
